,productID,body,recommendation_status
222,3493882,تازه دیروز به دستم رسید . یک سری نرم افزار را خودش دارد. مثل نماوا، آپارات . فیلیمو، تلوبیون، یوتیوب، نتفلیکس، ام ایکس پلیر، گوگل پلی ، و چیزهای دیگر. کارکردن با کنترل گیج کننده است. من مجبور شدم نسخه تی وی نماوا را نصب کنم. چون با نسخه ی خودش خوب نبود. بلوتوث ش به گوشی وصل نمیشه. خوشبختانه ماوس و کیبورد usb بهش وصل میشه و به راحتی کار می‌کنه. و لازم نیست ماوس بلوتوثی بگیرید. قطع و وصل هم نشد. فقط موقع راه اندازی توجه کنید که کیفیت تصویر را مطابق تلویزیون تون کنید. چون به صورت پیشفرض روی 4kهست. و تو تلویزیون من رنگهارا فقط بنفش و سبز نشون میداد. بعد از کلی سر و کله زدن فهمیدم که باید بزارم روی1080 . درست شد. یک سال هم گارانتی دارد.,recommended
223,3493882,کاملا واضح دست دوم بود مرجوع کردم ، هم زدگی داشت هم جای دست هم جی میل نفر قبلی رو دستگاه بود,not_recommended
224,3493882,با توجه به حافظه ۱۶ گیگ و رم ۲ گیگ انتخاب خوبی است,recommended
225,3493882,"دستگاه اندروید با3زیبا وکارامد
خیلی وسیله جالبیه فقط حتما هر که از دیجی کالا میخره همراهش یه موس بیسیمی هم سفارش بده واقعا کارو راحت میکنه",recommended
226,3493882,حقیقتا فکر نمیکردم دستگاه مناسبی باشه تو این رنج قیمت، ولی تا الان که عملکرد خوبی داشته. دستگاه با اتصال وای فای در فاصله نزدیک تست شد. سرعت اتصال خوب بود. دستگاه فیلیمو و آپارات رو بدون هیچ لگ و قطعی پخش کرد. اتصال ماوس به دستگاه عملکرد قابل قبولی داشت. نقاط قوت و ضعف بطور کامل گفته شده. حتما ویدئوهای جعبه گشایی و عملکرد دستگاه با اتصال به تلویزیون رو مشاهده کنید. سعی کردم چیزی از قلم نیوفته. ممنون,recommended
227,3493882,من دوتا از این دستگاه رو خریداری کردم و بعد مرجوع کردم بخاطر اینکه وای فای دستگاه بسیار ضعیفه و اگه وای فای داخل خونه باهاش بیشتر از دو متر فاصله داشته باشه دستگاه کار نمیکنه و به اینترنت وصل نمیشه من هم با وای فای امتحان کردم و هم با هات اسپات گوشی در هر دو این مشکل رو داشت و هر دو دستگاهی که خریدم هم این مشکل رو داشت,not_recommended
228,3493882,من تازه خریدمش. الان یک هفته است که دارم ازش استفاده می‌کنم. به نظرم با قیمت مناسبی که داره هیچ چیزی از سایر اندروید باکس‌ها که قیمت‌های بالایی هم دارن، کم نداره. تا الان اصلا هنگ نداشته و سرعت اتصال اینترنت از طریق وای فای هم خوبه. به نظرم برای وبگردی و استفاده از برخی اپلیکیشن‌ها، نیاز به موس داره. برای فیلم دیدن و استفاده از اپلیکیشن‌‌های رسانه‌ای مانند نماوا و فیلیمو، عالیه.,recommended
229,3493882,واقعا از لحاظ کیفیت خوب هست. بر خلاف کلاهای دیجیتالی گه از دیجیکالا میخریدم . دست دوم نبود و یکسال گارانتی داشت,recommended
230,3493882,دستگاه ساده و کار راه اندازیه ، هنگ هم نکرده فعلا ، انتظار بازی کردن ازش نداشته نباشین ، خرید ایر ریموت هم از واجباته,recommended
231,3493882,"درسته نکات منفی زیاد داره ولی چیز با ارزشیه من راضی هستم
برنامه های زیادی میشه نصب کرد مثل اینستاگرام و واتس‌اپ
برنامه های پیشفرض یکم ضعیفن من خودم بهترش رو دانلود کردم",recommended
232,3493882,از اینکه خروجی اُپتیکال داره وصدارو با کیفیت بالا تو اسپیکر میتونی داشته باشی وبا تصویر فول اچ دی که میده واقعا تجربه خوبیه.نسب به قیمتش خیلی خوبه,recommended
233,3493882,"با توجه به رم 2 و هارد 16 ، قیمت مناسب به نظر می رسد.
تست شد OK بود بعضی برنامه ها بعد از بروزرسانی با اختلال مواجه می شوند.",recommended
234,3493882,اشکال در اتصال بلوتوث داره، اصلا توی جستجو با موبایل نمیاد,no_idea
235,3493882,باکس خوبی است. سرعتش خوبه. اتصال با کابل شبکه و همینطور بی سیم خوب بود. یوتیوب و نت فلیکس رو هم بدون مشکل میاره,recommended
236,3493882,از هر نظر عالیه هم کیفیت تصویرش خوبه هم امکاناتش اندروید 9 داره فقط اگر میخواید راحت باهاش کار کنید ماوس بهش وصل کنید با کنترل یکم گیج شدم و راحت نبودم,recommended
237,3493882,با توجه به این هزینه مناسب ، به راحتی تلویزیونهای خودمونو میتونیم به داشتن سیستم عامل اندروید مجهز کنیم و از امکانات یک تلویزیون هوشمند بهره مند بشیم,recommended
238,3493882,دستگاه واقعا خوبیه بدون لگ فیلما رو پخش میکنه قیمتش مناسبه یوتیوب رو هم پخش میکنه برای بازی سبک هم خوبه فقط به گوشی متصل نشد شاید نرم افزار خاصی داشته باشه  من نتونستم متصل کنم,recommended
